Kompascom,Pikiranrakyat
artinya paling lama maret seluruh perselisihan hasil pilkada sudah harus diputus,hingga hari korban korban sriwijaya air sj berhasil teridentifikasi httpstco ibrfs
dugaan korupsi dilakukan tersangka terkait dana apbn kementerian kesehatan tahun sebesar rp m… httpstcouesng,shopeepay di masyarakat nikmati transaksi offline online di berbagai kategori httpstco
jepang masih menerapkan kondisi darurat berbagai kota besar termasuk tokyo lokasi penyelenggaraan olimpiade…,basarnas secara resmi menutup operasi sar sriwijaya air sj httpstcoz
internet heboh pria bermasker mengenakan syal tanpa katakata sigap membasmi kuman di podium m…,gempa guncang sulut lagi kini berkekuatan magnitudo pernah terjadi tahun
hari ini kamis dinas kesehatan ada kasus positif covid baru httpstco,hari pertama menjabat presiden as joe biden atur strategi melawan covid httpstcojm
sayangnya tidak ada tandatanda kehadiran dekisugi di stand by me doraemon dalam foto pernikahan nobita shiz… httpstcowvkrhf,terjadi serangan bom bunuh diri ledakan ganda tewaskan orang di baghdad tengah httpstco qkyqiy
kbri di kazakhstan mengapresiasi persahabatan fiki naki dayana pasalnya itu membuat indonesia semakin dikenal… httpstco kqhjr,dongkrak penjualan di awal tahun toyota tawarkan promo bunga ringan cicilan rendah httpstcorcbiklch
knkt masih terus mencari cvr pesawat sriwijaya air sj melengkapi data investigasi kecelakaan httpstcolrzwlg t,honda hadirkan layanan uji emisi gratis di bengkel resmi di jakarta
nantinya komcad sebagai kekuatan pertahanan negara digunakan secara tepat terpadu terarah bagi penan… httpstcofz j a,hubungannya sempat memanas presiden as joe biden akui dapat surat murah hati dari donald trump joebiden… httpstco w glc
boy william dibuat tercengang saat tahu harga satu kuda milik aleta molly seharga mobil lamborghini aleta punya ha…,kasus positif covid terus tinggi rsd wisma atlet buka ruang baru pasien httpstco
menurut wiku pekan ini ada kabupatenkota di jawa bali berstatus zona merah httpstcotlkon,sindir donald trump presiden iran hassan rouhani ucap syukur penindas telah digulingkan httpstco h ssf
menurut jokowi jika vaksinasi mandiri direalisasikan merk vaksin digunakan kemungkinan berbeda dari vak… httpstcow coms,gempa guncang indonesia lagi kini berkekuatan magnitudo pernah terjadi tahun httpstcov e
bagi warga negara terlibat dalam aktivitas komcad dianggap tengah melakukan suatu pengabdian dalam usaha pe… httpstco,sebut tahun momentum bangkit jokowi bocorkan industri masih bertahan httpstcoaqj
fasilitas covax dipimpin bersama who sudah menjalin kesepakatan lima produsen menghasilkan mil… httpstcol,catat sejarah baru pelajar indonesia raih medali emas olimpiade bahasa inggris di italia httpstcos
para ilmuwan mengaitkan beberapa makanan kehidupan seks lebih baik inilah beberapa makanan bisa b… httpstcooku,who berencana mengeluarkan banyak persetujuan vaksin covid peluncuran global httpstcodb vi
hendrar prihadi hevearita gunaryanti rahayu resmi ditetapkan sebagai wali kota wakil wali kota semarang ter… httpstcobnwe e,miliki beragam keunggulan sony hadirkan lensa fe mm f g master bobot ringan
menurut leonard pemeriksaan saksi bertujuan mencari fakta hukum mengumpulkan alat bukti terkait kasus ter… httpstco ixkhz,hasil positif ppkm mulai terasa di ciamis kasus covid turun hingga kesembuhan naik httpstcocobd
kemenhan pun berencana kembali melakukan perekrutan tahap kedua di jumlah peserta komcad tetap s… httpstcoz b v,waspada pasien covid terus meningkat rs darurat wisma atlet hampir penuh
melaney ricardo mengaku sempat khawatir kehilangan pekerjaan saat dinyatakan positif covid httpstcoqgcclmwd,turut berdukacita raja salman putranya kirim doa korban gempa sulawesi barat httpstcol
wilayah lempeng laut maluku tunjaman lempeng laut filipina merupakan salah satu kawasan seismik paling aktif d… httpstcom d,utarakan niatnya datangi kpk menparekraf sandiaga uno jangan sampai ada oknumoknum httpstcor kyi
perlu terobosan semakin baik kita tahu permasalahan ujar anggota komisi ix dpr ri intan fauzi httpstcoebfzjei,menkes korea selatan berharap herd immunity terhadap covid tercapai november httpstcoeajkjtm
sementara pasal dijelaskan bahwa pembentukan komponen cadangan dari unsur warga negara dikelompokkan me… httpstcoxsu u,penyebab harga daging sapi alami kenaikan ada kaitan kecenderungan masyarakat httpstcolzrtg
adapun dimaksud komponen utama ialah tentara nasional indonesia tni komponencadangan httpstcopuwuuq,hoaks menyesatkan banyak ditemukan tim jsh klarifikasi hoaks vaksinasi covid
merujuk beleid uu psdn dimaksud komcad adalah sumber daya nasional telah disiapkan dikerahkan m… httpstcocrvyfv,dampak meluapnya sungai cikeruh desa di rancaekek bandung terendam banjir httpstcocsvqbfim
wakil tunggal putra putri indonesia di thailand open ii telah habis kini indonesia tinggal memiliki tiga waki…,mahfud md ungkap satu janji calon kapolri listyo sigit prabowo penting tapi tak banyak diberitakan mahfudmd…
bams eks samsons cerita berhasil turunkan bobot badan hingga kilogram dalam bulan tapi tak rekomendasikan… httpstcocqprvm,bocorkan satu janji berani dari kapolri listyo sigit prabowo mahfud md ini penting httpstcof wyg bt
dirjen potensi pertahanan kementerian pertahanan kemenhan bondan tiara sofyan mengatakan program komponen cad… httpstcoqj,jalani isolasi mandiri meski hasilnya negatif gisel ungkap pesan manis dari gempita httpstcox
cara membuat sapo tahu atau claypot tofu pakai mangkuk tembikar kamu dapat bikin sendiri di rumah pakai wajan ceku… httpstco xbw,puan maharani ketok palu dpr setujui listyo sigit jadi kapolri gantikan idham aziz httpstco
thread pp diteken jokowi warga bisa jadi komponen cadangan perkuat tni komponencadangan httpstcoqyr,hatta rajasa sampaikan keprihatinan menparekraf sandiaga uno soal perekonomian
tpu rorotan belum digunakan pemprov dki jakarta masih menggunakan petak makam masih ada di tempat… httpstco wr wc,kabar duka ayahanda penyanyi dangdut nella kharisma meninggal dunia httpstcopmac
melebihi presiden as terdahulu ada satu kata diulang kali biden di seluruh pidatonya httpstcocq hb z,helikopter as jatuh terbakar di lahan pertanian begini nasib para tentara di dalamnya httpstcotqlxxtx
hingga saat ini jenazah korban sriwijaya air sj sudah teridentifikasi dari jumlah itu jenazah sudah dis… httpstcoskpyzs,dorong tingkat kesembuhan jateng gencarkan donor plasma konvalesen telah capai orang
tim gabungan resmi menghentikan operasi sar pencarian pertolongan jatuhnya pesawat sriwijaya air sj pada… httpstcoowm he m,hadapi sampah kiriman terdampar di pantai badung bali sekda butuh penanganan serius
haji permata tertembak saat petugas bea cukai menangkap terduga pelaku pembawa rokok ilegal regional httpstcorvypas,pakistan sukses lakukan uji tembak rudal balistik shaheen iii jangkauan km httpstco hq rb
calon kapolri komjen listyo sigit prabowo berkeinginan mengedepankan penegakan hukum berbasis elektronik di bidang… httpstco zekux,formasi kuota pppk dipertanyakan ketua fghbsn para guru masih bingung httpstcoylejs
oktober adalah bulan trump paling banyak berbohong publik ada kebohongan di momenmomen jelang pilpr…,pencarian korban sriwijaya air sj terkendala jarak pandang arus kencang httpstcoiftt
namun wisatawan internasional baru bisa berkunjung dua minggu setelah mendapat dosis vaksin kedua mereka juga waj… httpstco kszsoqb,terus bergerak walau pandemi covid jateng bakal genjot ekspor produk herbal tahun ini
pasalnya pablo benua sudah mengirimkan voice note menyatakan bahwa ia pulang rumah sepekan atau dua p… httpstconinfd d,sandiaga uno tibatiba sambangi kpk jubir lembaga antirasuah bongkar alasannya httpstcosyxt
pemberlakukan pembatasan kegiatan masyarakat ppkm diperpanjang selama hari mulai januari hingga februari… httpstcoakz ine,tim penyelamat china masih berusaha menyelamatkan pekerja tambang terperangkap httpstcor
kami mendambakan wali kota solo misalnya ada dari papua orang jawa bisa jadi wali kota di papua setiap warga n…,tarif tol borr seksi iii a naik akhir januari wakil wali kota bogor ungkap alasannya
coba bikin dadar jagung versi simpel kamu membutuhkan jagung manis pipil telur tepung terigu selengkapnya… httpstcoa,dipromosikan ridwan kamil cari jodoh sahrul gunawan terima kasih kang httpstcote
sebanyak asn pemprov maluku telah terdata mengikuti tes cepat antigen httpstco,hingga jumlah penduduk indonesia lebih dari juta jiwa pulau jawa paling tinggi httpstcom fm q
rumah sakit umum daerah rsud mgr gabriel manek atambua kabupaten belu nusa tenggara timur ntt ditutup selama…,listyo sigit prabowo sah jadi kapolri baru ingin segera siapkan eksekusi rencana aksi listyosigitprabowo… httpstco nq
bupati sleman sri purnomo ternyata sempat bertemu hb x menteri kp dua hari sebelum dinyatakan posit… httpstcomsykhb,pamer pelukan hangat jerinx nora alexandra singgung soal tudingan miring kepadanya httpstcoospawer
dosen ipb dari fakultas kehutanan lingkungan omo rusdiana mengatakan ada beberapa faktor penyebab terjadinya… httpstcormcper,tunjukkan kuasa sebagai presiden as joe biden langsung babat kebijakan donald trump httpstcok pkc
sejumlah lokasi prospektif diprediksi menjadi incaran konsumen mencari rumah tahun httpstcot wcnlk,listyo sigit prabowo resmi jadi kapolri fadli zon lebih maju httpstcotmu p
melaney ricardo akui sempat berpikir takut mati saat terpapar virus corona atau positif covid karenanya m… httpstco lusf,liverpool vs burnley jordan henderson beberkan kekuatan terbesar the reds httpstcozeveu
bank dki menyediakan sistem pembayaran nontunai bagi masyarakat ingin donasi palang merah indonesia pmi httpstco xr tm,pemerintah dapat kepastian dari astrazeneca novavac airlangga hartarto pfizer segera httpstcov wzgz
mohammad ahsan memberi update soal kondisi cederanya usai memenangi laga derbi wakil merah putih babak besa… httpstcoxfkz,tunjukkan kuasanya sebagai presiden as joe biden langsung babat sejumlah kebijakan trump httpstcoo vtm
tim nasional sepak bola putri amerika serikat as kini punya kapten baru httpstcohmudepxb,listyo sigit prabowo resmi jadi kapolri fadli zon bisa bawa polri lebih maju httpstco ufm
